{
  "anti_sd": "ACCUCCUUU",
  "host": "Synechocystis sp. PCC 6803",
  "id": "karlsen2018:SGL_RS03715",
  "schema_version": "1.0",
  "sequence": "TATCAACTTGCCCCTAGCCCAGAAGCCAGAGCAACCCTAATCGATTTCCTTAGCTTTCTCCAGGAATACGGCGAATAAACGGCGAGCTTGATAATCTTGAATGAAATTTACCCAATATTTTTTAGCTACCAGACAAAGACCAGATCGGTTAATTATTCACTTGGAGTGGATAGAATACACTATGAACAATCCTCTCAAGG",
  "start_positions": [
    100
  ],
  "strand": "+",
  "temperature_c": 30
}
